{
  "scenario_id": "SC-CURRENT",
  "scenario_name": "Current Plan",
  "interventions": [
    {
      "scenario_id": "SC-CURRENT",
      "intervention_id": "INT-004",
      "target_asset_id": NaN,
      "intervention_type": "no_op",
      "parameters_json": "{}",
      "expected_derived_json": NaN,
      "expected_source": NaN,
      "construction_start_year": 2026,
      "construction_duration_months": 0,
      "activation_year": 2026,
      "during_construction_status": "operational",
      "capex_delta_rm": 0,
      "opex_delta_rm": 0,
      "validation_status": "validated",
      "status": "applied"
    }
  ],
  "years": {
    "2026": {
      "assets": {
        "B-03": {
          "asset_id": "B-03",
          "year": 2026,
          "occupancy_rate": 0.21,
          "vacancy_rate": 0.79,
          "vacancy_duration_months": 14.0,
          "footfall_daily": 320.0,
          "rental_income_per_visit_proxy": 8.219178082191782,
          "rental_income_rm": 960000.0,
          "noi_rm": -50962.0,
          "noi_yield": -0.0011324888888888888,
          "maintenance_surge_rm": 190962.0,
          "accessibility_score": 95.80398354369962,
          "effective_demand": 1820.0,
          "effective_demand_m2": 873.6,
          "effective_supply": 5200.0,
          "dsr": 0.168,
          "shade_proxy_score": 0.0,
          "metric_source": "derived",
          "model_version": "0.3.0",
          "utilisation_rate": NaN,
          "service_coverage": NaN,
          "cost_per_user_rm": NaN,
          "developable_area_m2": NaN,
          "potential_gfa_m2": NaN,
          "demand_supply_gap": NaN,
          "infrastructure_cost_rm": NaN,
          "green_coverage": NaN,
          "canopy_coverage": NaN,
          "green_per_capita_m2": NaN,
          "energy_intensity_kwh_m2": NaN
        },
        "F-02": {
          "asset_id": "F-02",
          "year": 2026,
          "occupancy_rate": NaN,
          "vacancy_rate": NaN,
          "vacancy_duration_months": NaN,
          "footfall_daily": NaN,
          "rental_income_per_visit_proxy": NaN,
          "rental_income_rm": NaN,
          "noi_rm": NaN,
          "noi_yield": NaN,
          "maintenance_surge_rm": NaN,
          "accessibility_score": 91.82604855289411,
          "effective_demand": NaN,
          "effective_demand_m2": NaN,
          "effective_supply": NaN,
          "dsr": NaN,
          "shade_proxy_score": NaN,
          "metric_source": "derived",
          "model_version": "0.3.0",
          "utilisation_rate": 0.22,
          "service_coverage": 0.9182604855289411,
          "cost_per_user_rm": 23.038605230386054,
          "developable_area_m2": NaN,
          "potential_gfa_m2": NaN,
          "demand_supply_gap": NaN,
          "infrastructure_cost_rm": NaN,
          "green_coverage": NaN,
          "canopy_coverage": NaN,
          "green_per_capita_m2": NaN,
          "energy_intensity_kwh_m2": NaN
        },
        "P-05": {
          "asset_id": "P-05",
          "year": 2026,
          "occupancy_rate": NaN,
          "vacancy_rate": NaN,
          "vacancy_duration_months": NaN,
          "footfall_daily": NaN,
          "rental_income_per_visit_proxy": NaN,
          "rental_income_rm": NaN,
          "noi_rm": NaN,
          "noi_yield": NaN,
          "maintenance_surge_rm": NaN,
          "accessibility_score": 86.62042009841349,
          "effective_demand": NaN,
          "effective_demand_m2": NaN,
          "effective_supply": NaN,
          "dsr": NaN,
          "shade_proxy_score": NaN,
          "metric_source": "derived",
          "model_version": "0.3.0",
          "utilisation_rate": NaN,
          "service_coverage": NaN,
          "cost_per_user_rm": NaN,
          "developable_area_m2": 3600.0,
          "potential_gfa_m2": 5400.0,
          "demand_supply_gap": -4326.4,
          "infrastructure_cost_rm": 720000.0,
          "green_coverage": NaN,
          "canopy_coverage": NaN,
          "green_per_capita_m2": NaN,
          "energy_intensity_kwh_m2": NaN
        },
        "G-01": {
          "asset_id": "G-01",
          "year": 2026,
          "occupancy_rate": NaN,
          "vacancy_rate": NaN,
          "vacancy_duration_months": NaN,
          "footfall_daily": NaN,
          "rental_income_per_visit_proxy": NaN,
          "rental_income_rm": NaN,
          "noi_rm": NaN,
          "noi_yield": NaN,
          "maintenance_surge_rm": NaN,
          "accessibility_score": 95.80398354369962,
          "effective_demand": NaN,
          "effective_demand_m2": NaN,
          "effective_supply": NaN,
          "dsr": NaN,
          "shade_proxy_score": 8.0,
          "metric_source": "derived",
          "model_version": "0.3.0",
          "utilisation_rate": NaN,
          "service_coverage": NaN,
          "cost_per_user_rm": NaN,
          "developable_area_m2": NaN,
          "potential_gfa_m2": NaN,
          "demand_supply_gap": NaN,
          "infrastructure_cost_rm": NaN,
          "green_coverage": 1.0,
          "canopy_coverage": 0.08,
          "green_per_capita_m2": 2.857142857142857,
          "energy_intensity_kwh_m2": NaN
        },
        "R-01": {
          "asset_id": "R-01",
          "year": 2026,
          "occupancy_rate": 0.92,
          "vacancy_rate": NaN,
          "vacancy_duration_months": NaN,
          "footfall_daily": NaN,
          "rental_income_per_visit_proxy": NaN,
          "rental_income_rm": NaN,
          "noi_rm": NaN,
          "noi_yield": NaN,
          "maintenance_surge_rm": NaN,
          "accessibility_score": 100.0,
          "effective_demand": NaN,
          "effective_demand_m2": NaN,
          "effective_supply": NaN,
          "dsr": NaN,
          "shade_proxy_score": NaN,
          "metric_source": "derived",
          "model_version": "0.3.0",
          "utilisation_rate": NaN,
          "service_coverage": NaN,
          "cost_per_user_rm": NaN,
          "developable_area_m2": NaN,
          "potential_gfa_m2": NaN,
          "demand_supply_gap": NaN,
          "infrastructure_cost_rm": NaN,
          "green_coverage": NaN,
          "canopy_coverage": NaN,
          "green_per_capita_m2": NaN,
          "energy_intensity_kwh_m2": NaN
        }
      },
      "scores": {
        "B-03": {
          "asset_id": "B-03",
          "asset_type": "commercial",
          "overall_score": 0.0,
          "financial_score": 26.24,
          "environmental_score": 0.0,
          "social_score": 36.82,
          "component_scores": {
            "financial": 26.24,
            "occupancy": 14.67,
            "demand": 0.0,
            "accessibility": 95.8,
            "environment": 0.0
          },
          "weights_used": {
            "financial": 0.35,
            "occupancy": 0.25,
            "demand": 0.2,
            "accessibility": 0.1,
            "environment": 0.1
          },
          "data_completeness": 1.0,
          "confidence": "high",
          "year": 2026,
          "model_version": "0.3.0"
        },
        "F-02": {
          "asset_id": "F-02",
          "asset_type": "community_facility",
          "overall_score": 83.39,
          "financial_score": 88.48,
          "environmental_score": null,
          "social_score": 82.94,
          "component_scores": {
            "utilisation": 73.33,
            "coverage": 83.65,
            "accessibility": 91.83,
            "cost_efficiency": 88.48
          },
          "weights_used": {
            "utilisation": 0.29411764705882354,
            "coverage": 0.29411764705882354,
            "accessibility": 0.23529411764705885,
            "cost_efficiency": 0.17647058823529413
          },
          "data_completeness": 0.8,
          "confidence": "medium",
          "year": 2026,
          "model_version": "0.3.0"
        },
        "P-05": {
          "asset_id": "P-05",
          "asset_type": "undeveloped_parcel",
          "overall_score": 0.0,
          "financial_score": 100.0,
          "environmental_score": null,
          "social_score": 43.31,
          "component_scores": {
            "development_feasibility": 100.0,
            "demand": 0.0,
            "accessibility": 86.62
          },
          "weights_used": {
            "development_feasibility": 0.39999999999999997,
            "demand": 0.3333333333333333,
            "accessibility": 0.26666666666666666
          },
          "data_completeness": 0.6,
          "confidence": "medium",
          "year": 2026,
          "model_version": "0.3.0"
        },
        "G-01": {
          "asset_id": "G-01",
          "asset_type": "green_space",
          "overall_score": 7.14,
          "financial_score": null,
          "environmental_score": 30.33,
          "social_score": 95.8,
          "component_scores": {
            "green_coverage": 100.0,
            "canopy": 8.57,
            "accessibility": 95.8,
            "thermal": 8.0,
            "usage": 4.76
          },
          "weights_used": {
            "green_coverage": 0.25,
            "canopy": 0.2,
            "accessibility": 0.2,
            "thermal": 0.2,
            "usage": 0.15
          },
          "data_completeness": 1.0,
          "confidence": "high",
          "year": 2026,
          "model_version": "0.3.0"
        },
        "R-01": {
          "asset_id": "R-01",
          "asset_type": "residential",
          "overall_score": 92.99,
          "financial_score": null,
          "environmental_score": null,
          "social_score": 94.29,
          "component_scores": {
            "occupancy": 91.43,
            "demand": 91.43,
            "accessibility": 100.0
          },
          "weights_used": {
            "occupancy": 0.45454545454545453,
            "demand": 0.36363636363636365,
            "accessibility": 0.18181818181818182
          },
          "data_completeness": 0.6,
          "confidence": "medium",
          "year": 2026,
          "model_version": "0.3.0"
        }
      }
    },
    "2027": {